{
  "accepted_historical_coverage_proof": false,
  "accepted_under_strict_free": true,
  "auth_required": false,
  "caveats": [
    "USD spot reference only; never relabel rows as Hyperliquid-native data",
    "spot/perpetual symbol-map verification is required before use",
    "endpoint-specific since, interval, and rate limits must be enforced before any backfill",
    "availability matrix and raw request/response preservation are required before download"
  ],
  "cost_class": "public_rate_limited",
  "data_families": [
    "universe_metadata",
    "candles",
    "trades",
    "bbo",
    "l2_order_book",
    "spot_oracle_context"
  ],
  "history_mode": "public_spot_market_data_context",
  "market_type": "spot",
  "native_to_hyperliquid": false,
  "paid_required": false,
  "priority": "P2",
  "provenance_required": [
    "source_registry_source_id",
    "symbol_map_ref",
    "raw_request_id",
    "raw_response_id",
    "raw_payload_sha256",
    "endpoint",
    "params",
    "row_count",
    "rate_limit_metadata"
  ],
  "rate_limit_policy": {
    "max_parallel_downloads": 1,
    "page_cap": 720,
    "retry_backoff_seconds": [
      1,
      2,
      5,
      10
    ]
  },
  "research_role": "external_comparison",
  "required_operator_gate": [],
  "schema_version": "v2.0",
  "secret_required": false,
  "source_id": "kraken_spot_public",
  "source_url_template": "https://api.kraken.com/0/public/{endpoint}",
  "strict_zero_dollar_allowed": true,
  "venue": "kraken"
}
