{
  "accepted_historical_coverage_proof": false,
  "accepted_under_strict_free": true,
  "auth_required": false,
  "caveats": [
    "oracle reference context only; never relabel rows as Hyperliquid-native data",
    "Pyth feed ID mapping must be verified before use",
    "latest/streaming oracle updates are context data, not trade, fill, or order-book evidence",
    "availability matrix and raw request/response preservation are required before download"
  ],
  "cost_class": "public_rate_limited",
  "data_families": [
    "universe_metadata",
    "spot_oracle_context"
  ],
  "history_mode": "public_oracle_feed_context",
  "market_type": "oracle",
  "native_to_hyperliquid": false,
  "paid_required": false,
  "priority": "P2",
  "provenance_required": [
    "source_registry_source_id",
    "symbol_map_ref",
    "raw_request_id",
    "raw_response_id",
    "raw_payload_sha256",
    "endpoint",
    "params",
    "feed_id",
    "row_count",
    "rate_limit_metadata"
  ],
  "rate_limit_policy": {
    "max_parallel_downloads": 1,
    "page_cap": 100,
    "retry_backoff_seconds": [
      1,
      2,
      5,
      10
    ]
  },
  "research_role": "spot_or_oracle_context",
  "required_operator_gate": [],
  "schema_version": "v2.0",
  "secret_required": false,
  "source_id": "pyth_hermes_public",
  "source_url_template": "https://hermes.pyth.network/v2/{endpoint}",
  "strict_zero_dollar_allowed": true,
  "venue": "pyth"
}
